query_time,query,answer,response_0,response_1
0.7972130000125617,What is an AI accelerator?,"An AI accelerator, also referred to as deep learning processor, or neural processing unit (NPU), is a class of specialized hardware accelerator or computer system designed to accelerate artificial intelligence and machine learning applications, including artificial neural networks and machine vision.",Cosine Similarity: 0.8629087313331788 / An AI accelerator: deep learning processor: or neural processing unit (NPU) is a class of specialized hardware accelerator or computer system designed to accelerate artificial intelligence and machine learning applications: including artificial neural networks and machine vision.,"Cosine Similarity: 0.8617515818136974 / == Nomenclature == /  / As of 2016: the field is still in flux and vendors are pushing their own marketing term for what amounts to an ""AI accelerator"": in the hope that their designs and APIs will become the dominant design."
0.719247400003951,Where are AI accelerators often used?,"AI accelerators are used in various devices, including mobile devices such as neural processing units (NPUs) in Apple iPhones or Huawei cellphones, and personal computers such as Apple silicon Macs, to cloud computing servers such as tensor processing units (TPU) in the Google Cloud Platform. ",Cosine Similarity: 0.8788130765421266 / Table 2 lists several typical benchmarks for AI accelerators.,Cosine Similarity: 0.872348057373247 / Graphics processing units designed by companies such as Nvidia and AMD often include AI-specific hardware: and are commonly used as AI accelerators: both for training and inference.
0.7121677999966778,How have GPUs been utilized for AI acceleration?,"Graphics processing units or GPUs, that are specialized hardware for the manipulation of images and calculation of local image properties, have been increasingly used for machine learning tasks. GPU developers have also incorporated neural network-specific hardware to further accelerate these tasks.",Cosine Similarity: 0.9127457492293591 / As GPUs have been increasingly applied to AI acceleration: GPU manufacturers have incorporated neural network-specific hardware to further accelerate these tasks.,Cosine Similarity: 0.9023623672880091 / GPUs continue to be used in large-scale AI applications.
0.6935569999914151,What has been the progress of AI accelerator technology in the 1990s?,"In the 1990s, attempts were made to create high-throughput parallel systems for workstations aimed at various applications, including neural network simulations. FPGA-based accelerators for both inference and training were first explored in the 1990s.",Cosine Similarity: 0.8637032937462458 / As deep learning and artificial intelligence workloads rose in prominence in the 2010s: specialized hardware units were developed or adapted from existing products to accelerate these tasks.,Cosine Similarity: 0.8435222471438308 / As early as 1993: digital signal processors were used as neural network accelerators to accelerate optical character recognition software.By 1988: Wei Zhang et al.
0.7027099000115413,What is the difference between CPUs and AI accelerators in terms of performing AI-related tasks?,"While CPUs are used for running AI workloads and are superior for DNNs with small or medium-scale parallelism, for sparse DNNs and in low-batch-size scenarios, specialized AI accelerators like GPUs and FPGAs perform far better due to their optimized memory use and the use of lower precision arithmetic to accelerate calculation and increase throughput of computation. In fact, ASICs, a specific design of accelerators, may provide up to 10 times the efficiency of CPUs for AI-related tasks.",Cosine Similarity: 0.8790633181325637 / === Emergence of dedicated AI accelerator ASICs === /  / While GPUs and FPGAs perform far better than CPUs for AI-related tasks: a factor of up to 10 in efficiency may be gained with a more specific design: via an application-specific integrated circuit (ASIC).,Cosine Similarity: 0.863767899999669 / Due to the increasing performance of CPUs: they are also used for running AI workloads.
0.6854800999863073,What is the BERT model?,"The Bidirectional Encoder Representations from Transformers (BERT) is a language model based on the transformer architecture, introduced in October 2018 by researchers at Google. It is known for its significant improvement over previous models. BERT was originally implemented in the English language and has become a ubiquitous baseline in Natural Language Processing (NLP) experiments.",Cosine Similarity: 0.9017703695964713 / Bidirectional Encoder Representations from Transformers (BERT) is a language model based on the transformer architecture: notable for its dramatic improvement over previous state of the art models.,Cosine Similarity: 0.8943952231011779 / Unlike previous models: BERT is a deeply bidirectional: unsupervised language representation: pre-trained using only a plain text corpus.
0.6543107000179589,How is BERT pretrained?,"BERT was pre-trained simultaneously on two tasks: language modeling and next sentence prediction. In language modeling, a portion of the tokens in the text were selected for prediction and were replaced with a [MASK] token, a random word token, or not replaced. The next sentence prediction task involved predicting if two spans of text appeared sequentially in the training corpus, outputting either [IsNext] or [NotNext].",Cosine Similarity: 0.8779266397260788 / Unlike previous models: BERT is a deeply bidirectional: unsupervised language representation: pre-trained using only a plain text corpus.,Cosine Similarity: 0.8755866936969097 / After pre-training: BERT can be fine-tuned with fewer resources on smaller datasets to optimize its performance on specific tasks such as NLP tasks (language inference: text classification) and sequence-to-sequence based language generation tasks (question-answering: conversational response generation).
0.730031000013696,Can you describe the architecture of BERT?,"BERT is an ""encoder-only"" transformer architecture. It consists of an embedding module, a stack of encoders, and an un-embedding module. The lowest layer is the embedding layer which contains word embeddings, position embeddings, and token type embeddings. The representation vectors then move through Transformer encoders and are then un-embedded.",Cosine Similarity: 0.881961817477122 / === Architecture details === /  / This section describes BERTBASE.,"Cosine Similarity: 0.8671212767626246 / == Design == /  / BERT is an ""encoder-only"" transformer architecture."
0.6877316000172868,How does BERT perform in natural language understanding tasks?,"When BERT was published, it achieved state-of-the-art performance on a number of natural language understanding tasks including the GLUE (General Language Understanding Evaluation) task set, SQuAD (Stanford Question Answering Dataset), and SWAG (Situations With Adversarial Generations).",Cosine Similarity: 0.9126384487213499 / == Performance == /  / When BERT was published: it achieved state-of-the-art performance on a number of natural language understanding tasks: /  / GLUE (General Language Understanding Evaluation) task set (consisting of 9 tasks) /  / SQuAD (Stanford Question Answering Dataset) v1.1 and v2.0 /  / SWAG (Situations With Adversarial Generations) /  /  /  /  /  / == Analysis == /  / The reasons for BERT's state-of-the-art performance on these natural language understanding tasks are not yet well understood.,"Cosine Similarity: 0.8903923246358857 / A 2020 literature survey concluded that ""in a little over a year: BERT has become a ubiquitous baseline in Natural Language Processing (NLP) experiments counting over 150 research publications analyzing and improving the model."
0.6739417999924626,Who were the original researchers behind BERT and what innovation did it provide over previous models?,"BERT was originally published by Google researchers Jacob Devlin, Ming-Wei Chang, Kenton Lee, and Kristina Toutanova. Unlike previous models such as word2vec or GloVe which generated a single word embedding representation for each word in the vocabulary, BERT takes into account the context for each occurrence of a given word, providing a contextualized embedding that varies according to the sentence.",Cosine Similarity: 0.8757627793226866 / == History == /  / BERT was originally published by Google researchers Jacob Devlin: Ming-Wei Chang: Kenton Lee: and Kristina Toutanova.,"Cosine Similarity: 0.8653543618649632 / A 2020 literature survey concluded that ""in a little over a year: BERT has become a ubiquitous baseline in Natural Language Processing (NLP) experiments counting over 150 research publications analyzing and improving the model."
0.6185662999923807,What is the BigScience Large Open-science Open-access Multilingual Language Model (BLOOM)?,"The BigScience Large Open-science Open-access Multilingual Language Model (BLOOM) is a 176-billion-parameter transformer-based autoregressive large language model (LLM), trained on approximately 366 billion tokens from March to July 2022. ",Cosine Similarity: 0.9543515695558433 / BigScience Large Open-science Open-access Multilingual Language Model (BLOOM) is a 176-billion-parameter transformer-based autoregressive large language model (LLM).,Cosine Similarity: 0.8631262837867925 / BLOOM was trained on approximately 366 billion (1.6TB) tokens from March to July 2022.BLOOM is the main outcome of the BigScience collaborative initiative: a one-year-long research workshop that took place between May 2021 and May 2022.
0.6110635999939404,What is unique about BLOOM's licensing?,"BLOOM, its code base, and the data used to train it are all distributed under free licenses, which makes the resources open and accessible to the general public.",Cosine Similarity: 0.8087444892313346 / BigScience Large Open-science Open-access Multilingual Language Model (BLOOM) is a 176-billion-parameter transformer-based autoregressive large language model (LLM).,Cosine Similarity: 0.8050392125807003 / BLOOM was trained on approximately 366 billion (1.6TB) tokens from March to July 2022.BLOOM is the main outcome of the BigScience collaborative initiative: a one-year-long research workshop that took place between May 2021 and May 2022.
0.7626002999895718,What are the origins of BLOOM?,"BLOOM was the main result of the BigScience collaborative initiative, a one-year-long research workshop that took place between May 2021 and May 2022. It was led by HuggingFace and involved several hundreds of researchers and engineers from France and globally, including both academia and the private sector.",Cosine Similarity: 0.8385294438531115 / BLOOM was trained on approximately 366 billion (1.6TB) tokens from March to July 2022.BLOOM is the main outcome of the BigScience collaborative initiative: a one-year-long research workshop that took place between May 2021 and May 2022.,Cosine Similarity: 0.8377483477459923 / BLOOM's training corpus: named ROOTS: combines data extracted from the then-latest version of the web-based OSCAR corpus (38% of ROOTS) and newly collected data extracted from a manually selected and documented list of language data sources.
0.633903999987524,On which supercomputer was BLOOM trained and who supported the training?,"BLOOM was trained on the French public supercomputer Jean Zay, managed by GENCI and IDRIS (CNRS). BigScience, the initiative behind BLOOM, was supported by a large-scale public compute grant on Jean Zay.",Cosine Similarity: 0.8573338598853251 / BLOOM was trained on approximately 366 billion (1.6TB) tokens from March to July 2022.BLOOM is the main outcome of the BigScience collaborative initiative: a one-year-long research workshop that took place between May 2021 and May 2022.,Cosine Similarity: 0.8330551798800658 / BigScience was supported by a large-scale public compute grant on the French public supercomputer Jean Zay: managed by GENCI and IDRIS (CNRS): on which it was trained.
0.628807599976426,"Can you tell me more about BLOOM's training corpus, ROOTS?","ROOTS is the training corpus for BLOOM and combines data extracted from the web-based OSCAR corpus (38% of ROOTS) and newly collected data from a manually selected list of language data sources. It includes data in 46 natural languages, with English forming 30% of the whole dataset to as little as 0.00002% for Chi Tumbuka, as well as data in 13 different programming languages.",Cosine Similarity: 0.9150917433813257 / BLOOM's training corpus: named ROOTS: combines data extracted from the then-latest version of the web-based OSCAR corpus (38% of ROOTS) and newly collected data extracted from a manually selected and documented list of language data sources.,Cosine Similarity: 0.841160095484106 / BLOOM was trained on approximately 366 billion (1.6TB) tokens from March to July 2022.BLOOM is the main outcome of the BigScience collaborative initiative: a one-year-long research workshop that took place between May 2021 and May 2022.
0.6145252999849617,What is Chinchilla and when was it presented?,"Chinchilla is a family of large language models developed by the research team at DeepMind, presented in March 2022.","Cosine Similarity: 0.8591267680532445 / It is named ""chinchilla"" because it is a further development over a previous model family named Gopher.",Cosine Similarity: 0.8533154845246735 / Chinchilla is a family of large language models developed by the research team at DeepMind: presented in March 2022.
0.6568964000034612,How does Chinchilla compare to the previous model named Gopher?,"Chinchilla is a further development over Gopher. It requires less computer power for inference and fine-tuning, has an average accuracy of 67.5% on the MMLU benchmark which is 7% higher than Gopher, and has 70 billion parameters with four times as much data.","Cosine Similarity: 0.9264452353054111 / It is named ""chinchilla"" because it is a further development over a previous model family named Gopher.",Cosine Similarity: 0.8888068093282753 / The Chinchilla family is the same as the Gopher family: but trained with AdamW instead of Adam optimizer.
0.5693286999885458,What hypothesis was used to train the Chinchilla by DeepMind?,"The hypothesis used to train Chinchilla by DeepMind is that if one doubles the model size, one must also have twice the number of training tokens.",Cosine Similarity: 0.9680472880073929 / This hypothesis has been used to train Chinchilla by DeepMind.,Cosine Similarity: 0.8738123371802412 / Chinchilla is a family of large language models developed by the research team at DeepMind: presented in March 2022.
0.6211097000050358,How are the Chinchilla and Gopher families similar in terms of architecture?,"Both the Gopher and Chinchilla families are transformer models. They are essentially the same as GPT-2, with different sizes and minor modifications. Gopher uses RMSNorm instead of LayerNorm, and relative positional encoding rather than absolute. Chinchilla is the same as Gopher but trained with AdamW instead of Adam optimizer.",Cosine Similarity: 0.9013982326301927 / == Architecture == /  / Both the Gopher family and Chinchilla family are families of transformer models.,Cosine Similarity: 0.8850712634625507 / Similar naming conventions apply for the Chinchilla family.
0.657849899987923,"What is the status of Chinchilla as of January 12, 2023?","As of January 12, 2023, Chinchilla was still in the testing phase.",Cosine Similarity: 0.8763450195597666 / Chinchilla was still in the testing phase as of January 12: 2023.Chinchilla contributes to developing an effective training paradigm for large autoregressive language models with limited compute resources.,Cosine Similarity: 0.854621732537518 / Chinchilla is a family of large language models developed by the research team at DeepMind: presented in March 2022.
