query_time,query,answer,response_0,response_1
0.590669799974421,What are some types of artificial neural networks that have been implemented as optical neural networks?,"Some artificial neural networks that have been implemented as optical neural networks include the Hopfield neural network and the Kohonen self-organizing map, often with liquid crystal spatial light modulators.",Cosine Similarity: 0.9011510403857975 / This research led to extensive research on alternative methods using the strength of the optical interconnect for implementing neuronal communications.Some artificial neural networks that have been implemented as optical neural networks include the Hopfield neural network and the Kohonen self-organizing map with liquid crystal spatial light modulators  Optical neural networks can also be based on the principles of neuromorphic engineering: creating neuromorphic photonic systems.,Cosine Similarity: 0.9010625871253152 / An optical neural network is a physical implementation of an artificial neural network with optical components.
0.5953599000058603,How do biological neural networks differ from optical neural networks?,"Biological neural networks function on an electrochemical basis, while optical neural networks use electromagnetic waves. The mechanisms for dynamically changing the state of the neurons in a biological network include short-term and long-term synaptic plasticity.",Cosine Similarity: 0.9182291253547887 / == Electrochemical vs. optical neural networks == /  / Biological neural networks function on an electrochemical basis: while optical neural networks use electromagnetic waves.,Cosine Similarity: 0.9035197252980909 / Optical interfaces to biological neural networks can be created with optogenetics: but is not the same as an optical neural networks.
0.6474647999857552,What are the two primary methods of optical neural computing currently under research?,"The two primary methods of optical neural computing under research are silicon photonics-based and free-space optics. Silicon photonics offer superior speed, while free-space optics deliver massive parallelism.",Cosine Similarity: 0.9435276986611388 / Presently: two primary methods of optical neural computing are under research: silicon photonics-based and free-space optics.,Cosine Similarity: 0.8779604375291484 / There are two main types of neural network.
0.632468499999959,What was significant about the Programmable Optical Array/Analogic Computer (POAC)?,"The Programmable Optical Array/Analogic Computer (POAC) was a model of an optical neural network implemented in 2000. It utilized a Joint Fourier Transform Correlator (JTC) and Bacteriorhodopsin (BR) as a holographic optical memory. It promised full parallelism, large array size, and the speed of light for implementing an optical CNN.",Cosine Similarity: 0.9082818001941217 / == Other Implementations == /  / In 2007 there was one model of Optical Neural Network: the Programmable Optical Array/Analogic Computer (POAC).,Cosine Similarity: 0.9042666921797458 / However: POAC is a general purpose and programmable array computer that has a wide range of applications including: /  /  /  / image processing /  / pattern recognition /  / target tracking /  / real-time video processing /  / document security /  / optical switching /  /  /  /  /  / == See also == /  / Optical computing /  / Quantum neural network /  /  /  /  /  / == References ==
0.654128900001524,What are Physics-informed neural networks (PINNs)?,"Physics-informed neural networks (PINNs) are universal function approximators that can integrate the knowledge of any physical laws governing a given data-set in the learning process. They can be described by partial differential equations (PDEs) and help overcome the low data availability of some biological and engineering systems. They increase the correctness of the function approximation and enhance the information content of the available data, making learning algorithms capture the right solution and generalize well.",Cosine Similarity: 0.9430293620038922 / Physics-informed neural networks (PINNs) are a type of universal function approximators that can embed the knowledge of any physical laws that govern a given data-set in the learning process: and can be described by partial differential equations (PDEs).,Cosine Similarity: 0.9284975639621684 / On the other hand: physics-informed neural networks (PINNs) leverage governing physical equations in neural network training.
0.6389416000165511,How do PINNs work in terms of function approximation?,"PINNs work by leveraging governing physical equations in neural network training. They are designed to be trained to satisfy the given training data and the imposed governing equations. This means that a neural network can be guided with training data that do not necessarily need to be large and complete. Thus, even with sparse and incomplete data, PINN may be used for finding an optimal solution with high fidelity.",Cosine Similarity: 0.8671805535169768 / Physics-informed neural networks (PINNs) are a type of universal function approximators that can embed the knowledge of any physical laws that govern a given data-set in the learning process: and can be described by partial differential equations (PDEs).,Cosine Similarity: 0.8655300160160322 / Namely: PINNs are designed to be trained to satisfy the given training data as well as the imposed governing equations.
0.6057059000013396,What is the significance of automatic differentiation (AD) in PINNs?,Automatic differentiation (AD) is exploited in PINNs to compute the required derivatives in the partial differential equations. It's a new class of differentiation techniques widely used to derive neural networks and is considered superior to numerical or symbolic differentiation.,Cosine Similarity: 0.8684474653837502 / In addition: they allow for exploiting automatic differentiation (AD) to compute the required derivatives in the partial differential equations: a new class of differentiation techniques widely used to derive neural networks assessed to be superior to numerical or symbolic differentiation.,Cosine Similarity: 0.8411381205633838 / This network can be differentiated using automatic differentiation.
0.6264435000193771,How can PINNs be applied for piece-wise function approximation?,"For problems with strong non-linearity or sharp gradients, lightweight PINNs are used for piece-wise approximation, which increases accuracy substantially and decreases computational load. Distributed physics-informed neural networks (DPINNs) and Distributed physics-informed extreme learning machines (DPIELMs) are used for better approximation, solving PDEs in much larger discrete subdomains.",Cosine Similarity: 0.8603142806231153 / With the capability of approximating strong non-linearity extremely light weight PINNs are used to solve PDEs in much larger discrete subdomains that increases accuracy substantially and decreases computational load as well.,Cosine Similarity: 0.858930382508165 / Piece-wise approximation has been an old practice in the field of numerical approximation.
0.7094977000087965,What limitations do PINNs have?,"PINNs struggle to approximate translation and discontinuous behavior. They fail when solving differential equations with slight advective dominance and are not successful in solving chaotic equations. One of the reasons for this is the soft-constraining of Dirichlet and Neumann boundary conditions which pose multi-objective optimization problems. This necessitates the need for manually weighing the loss terms for optimization. Also, there is the risk of getting stuck at a local optimum often.",Cosine Similarity: 0.8705060115195212 / == Limitations == /  / Translation and discontinuous behavior are hard to approximate using PINNs.,Cosine Similarity: 0.8685282681205501 / This limitation of regular PINNs imposes high computational costs: specifically for a comprehensive investigation of geometric parameters in industrial designs.
0.64478699999745,Who were the first to publish ideas on quantum neural computation?,The first ideas on quantum neural computation were published independently in 1995 by Subhash Kak and Ron Chrisley.,Cosine Similarity: 0.8427313556526409 / Quantum neural networks are computational neural network models which are based on the principles of quantum mechanics.The first ideas on quantum neural computation were published independently in 1995 by Subhash Kak and Ron Chrisley: engaging with the theory of quantum mind: which posits that quantum effects play a role in cognitive function. However: typical research in quantum neural networks involves combining classical artificial neural network models (which are widely used in machine learning for the important task of pattern recognition) with the advantages of quantum information in order to develop more efficient algorithms. One important motivation for these investigations is the difficulty to train classical neural networks: especially in big data applications. The hope is that features of quantum computing such as quantum parallelism or the effects of interference and entanglement can be used as resources. Since the technological implementation of a quantum computer is still in a premature stage: such quantum neural network models are mostly theoretical proposals that await their full implementation in physical experiments. Most Quantum neural networks are developed as feed-forward networks. Similar to their classical counterparts: this structure intakes input from one layer of qubits: and passes that input onto another layer of qubits. This layer of qubits evaluates this information and passes on the output to the next layer. Eventually the path leads to the final layer of qubits. The layers do not have to be of the same width: meaning they don't have to have the same number of qubits as the layer before or after it. This structure is trained on which path to take similar to classical artificial neural networks. This is discussed in a lower section. Quantum neural networks refer to three different categories: Quantum computer with classical data: classical computer with quantum data: and quantum computer with quantum data. == Examples == /  / Quantum neural network research is still in its infancy: and a conglomeration of proposals and ideas of varying scope and mathematical rigor have been put forward. Most of them are based on the idea of replacing classical binary or McCulloch-Pitts neurons with a qubit (which can be called a “quron”): resulting in neural units that can be in a superposition of the state ‘firing’ and ‘resting’. === Quantum perceptrons === /  / A lot of proposals attempt to find a quantum equivalent for the perceptron unit from which neural nets are constructed. A problem is that nonlinear activation functions do not immediately correspond to the mathematical structure of quantum theory: since a quantum evolution is described by linear operations and leads to probabilistic observation. Ideas to imitate the perceptron activation function with a quantum mechanical formalism reach from special measurements  to postulating non-linear quantum operators (a mathematical framework that is disputed). A direct implementation of the activation function using the circuit-based model of quantum computation has recently been proposed by Schuld: Sinayskiy and Petruccione based on the quantum phase estimation algorithm. === Quantum networks === /  / At a larger scale: researchers have attempted to generalize neural networks to the quantum setting. One way of constructing a quantum neuron is to first generalise classical neurons and then generalising them further to make unitary gates. Interactions between neurons can be controlled quantumly: with unitary gates: or classically: via measurement of the network states. This high-level theoretical technique can be applied broadly: by taking different types of networks and different implementations of quantum neurons: such as photonically implemented neurons and quantum reservoir processor (quantum version of reservoir computing). Most learning algorithms follow the classical model of training an artificial neural network to learn the input-output function of a given training set and use classical feedback loops to update parameters of the quantum system until they converge to an optimal configuration. Learning as a parameter optimisation problem has also been approached by adiabatic models of quantum computing.Quantum neural networks can be applied to algorithmic design: given qubits with tunable mutual interactions: one can attempt to learn interactions following the classical backpropagation rule from a training set of desired input-output relations: taken to be the desired output algorithm's behavior. The quantum network thus ‘learns’ an algorithm. === Quantum associative memory === /  / The first quantum associative memory algorithm was introduced by Dan Ventura and Tony Martinez in 1999. The authors do not attempt to translate the structure of artificial neural network models into quantum theory: but propose an algorithm for a circuit-based quantum computer that simulates associative memory. The memory states (in Hopfield neural networks saved in the weights of the neural connections) are written into a superposition: and a Grover-like quantum search algorithm retrieves the memory state closest to a given input. As such: this is not a fully content-addressable memory: since only incomplete patterns can be retrieved. The first truly content-addressable quantum memory: which can retrieve patterns also from corrupted inputs: was proposed by Carlo A. Trugenberger. Both memories can store an exponential (in terms of n qubits) number of patterns but can be used only once due to the no-cloning theorem and their destruction upon measurement. Trugenberger: however: has shown that his proababilistic model of quantum associative memory can be efficiently implemented and re-used multiples times for any polynomial number of stored patterns: a large advantage with respect to classical associative memories. === Classical neural networks inspired by quantum theory === /  / A substantial amount of interest has been given to a “quantum-inspired” model that uses ideas from quantum theory to implement a neural network based on fuzzy logic. == Training == /  / Quantum Neural Networks can be theoretically trained similarly to training classical/artificial neural networks. A key difference lies in communication between the layers of a neural networks. For classical neural networks: at the end of a given operation: the current perceptron copies its output to the next layer of perceptron(s) in the network. However: in a quantum neural network: where each perceptron is a qubit: this would violate the no-cloning theorem. A proposed generalized solution to this is to replace the classical fan-out method with an arbitrary unitary that spreads out: but does not copy: the output of one qubit to the next layer of qubits. ,"Cosine Similarity: 0.8416989841949849 / Farley and Clark (1954) first used computational machines: then called ""calculators"": to simulate a Hebbian network."
0.6525132000097074,What is one of the main motivations for investigating quantum neural networks?,"One important motivation for investigating quantum neural networks is the challenge of training classical neural networks, particularly in big data applications.",Cosine Similarity: 0.8683272152437007 / Quantum neural networks are computational neural network models which are based on the principles of quantum mechanics.The first ideas on quantum neural computation were published independently in 1995 by Subhash Kak and Ron Chrisley: engaging with the theory of quantum mind: which posits that quantum effects play a role in cognitive function. However: typical research in quantum neural networks involves combining classical artificial neural network models (which are widely used in machine learning for the important task of pattern recognition) with the advantages of quantum information in order to develop more efficient algorithms. One important motivation for these investigations is the difficulty to train classical neural networks: especially in big data applications. The hope is that features of quantum computing such as quantum parallelism or the effects of interference and entanglement can be used as resources. Since the technological implementation of a quantum computer is still in a premature stage: such quantum neural network models are mostly theoretical proposals that await their full implementation in physical experiments. Most Quantum neural networks are developed as feed-forward networks. Similar to their classical counterparts: this structure intakes input from one layer of qubits: and passes that input onto another layer of qubits. This layer of qubits evaluates this information and passes on the output to the next layer. Eventually the path leads to the final layer of qubits. The layers do not have to be of the same width: meaning they don't have to have the same number of qubits as the layer before or after it. This structure is trained on which path to take similar to classical artificial neural networks. This is discussed in a lower section. Quantum neural networks refer to three different categories: Quantum computer with classical data: classical computer with quantum data: and quantum computer with quantum data. == Examples == /  / Quantum neural network research is still in its infancy: and a conglomeration of proposals and ideas of varying scope and mathematical rigor have been put forward. Most of them are based on the idea of replacing classical binary or McCulloch-Pitts neurons with a qubit (which can be called a “quron”): resulting in neural units that can be in a superposition of the state ‘firing’ and ‘resting’. === Quantum perceptrons === /  / A lot of proposals attempt to find a quantum equivalent for the perceptron unit from which neural nets are constructed. A problem is that nonlinear activation functions do not immediately correspond to the mathematical structure of quantum theory: since a quantum evolution is described by linear operations and leads to probabilistic observation. Ideas to imitate the perceptron activation function with a quantum mechanical formalism reach from special measurements  to postulating non-linear quantum operators (a mathematical framework that is disputed). A direct implementation of the activation function using the circuit-based model of quantum computation has recently been proposed by Schuld: Sinayskiy and Petruccione based on the quantum phase estimation algorithm. === Quantum networks === /  / At a larger scale: researchers have attempted to generalize neural networks to the quantum setting. One way of constructing a quantum neuron is to first generalise classical neurons and then generalising them further to make unitary gates. Interactions between neurons can be controlled quantumly: with unitary gates: or classically: via measurement of the network states. This high-level theoretical technique can be applied broadly: by taking different types of networks and different implementations of quantum neurons: such as photonically implemented neurons and quantum reservoir processor (quantum version of reservoir computing). Most learning algorithms follow the classical model of training an artificial neural network to learn the input-output function of a given training set and use classical feedback loops to update parameters of the quantum system until they converge to an optimal configuration. Learning as a parameter optimisation problem has also been approached by adiabatic models of quantum computing.Quantum neural networks can be applied to algorithmic design: given qubits with tunable mutual interactions: one can attempt to learn interactions following the classical backpropagation rule from a training set of desired input-output relations: taken to be the desired output algorithm's behavior. The quantum network thus ‘learns’ an algorithm. === Quantum associative memory === /  / The first quantum associative memory algorithm was introduced by Dan Ventura and Tony Martinez in 1999. The authors do not attempt to translate the structure of artificial neural network models into quantum theory: but propose an algorithm for a circuit-based quantum computer that simulates associative memory. The memory states (in Hopfield neural networks saved in the weights of the neural connections) are written into a superposition: and a Grover-like quantum search algorithm retrieves the memory state closest to a given input. As such: this is not a fully content-addressable memory: since only incomplete patterns can be retrieved. The first truly content-addressable quantum memory: which can retrieve patterns also from corrupted inputs: was proposed by Carlo A. Trugenberger. Both memories can store an exponential (in terms of n qubits) number of patterns but can be used only once due to the no-cloning theorem and their destruction upon measurement. Trugenberger: however: has shown that his proababilistic model of quantum associative memory can be efficiently implemented and re-used multiples times for any polynomial number of stored patterns: a large advantage with respect to classical associative memories. === Classical neural networks inspired by quantum theory === /  / A substantial amount of interest has been given to a “quantum-inspired” model that uses ideas from quantum theory to implement a neural network based on fuzzy logic. == Training == /  / Quantum Neural Networks can be theoretically trained similarly to training classical/artificial neural networks. A key difference lies in communication between the layers of a neural networks. For classical neural networks: at the end of a given operation: the current perceptron copies its output to the next layer of perceptron(s) in the network. However: in a quantum neural network: where each perceptron is a qubit: this would violate the no-cloning theorem. A proposed generalized solution to this is to replace the classical fan-out method with an arbitrary unitary that spreads out: but does not copy: the output of one qubit to the next layer of qubits. ,Cosine Similarity: 0.8474597193740226 / Biological neural networks are studied to understand the organization and functioning of nervous systems.
